{
  "id": "ins.maths.m4.algebraic-fractions-with-linear-denominators",
  "topic": "maths.m4.algebraic-fractions-with-linear-denominators",
  "specRefs": [
    "M4-NA-03",
    "M4-NA-04"
  ],
  "findings": [
    {
      "source": "ccea-cer:maths:2023-summer:M4:Q22",
      "url": "https://ccea.org.uk/downloads/docs/ExamMod-Reports/GCSE/GCSE%20Mathematics%20%282017%29/2023/GCSE%20Mathematics%20%282017%29-Summer2023-Report_0.pdf",
      "asked": "Solve an equation with two algebraic fractions that leads to a quadratic.",
      "wentWrong": "Only the more able finished. Errors when expanding brackets and collecting terms, dropping the negative root, and not rounding to 2 d.p. Weaker candidates could not start.",
      "fullMarkAnswersDid": "Combined the fractions over a common denominator, cross-multiplied to a quadratic, solved with the formula and gave both roots to 2 d.p.",
      "rule": "Both roots count unless the context rules one out; round only at the end.",
      "misconceptions": [
        "maths.algebra.bracket-expansion-sign",
        "maths.quadratics.negative-root-discarded",
        "maths.alg-fractions.cannot-start-common-denominator"
      ]
    },
    {
      "source": "ccea-cer:maths:2024-summer:M4:Q18",
      "url": "https://ccea.org.uk/downloads/docs/ExamMod-Reports/GCSE/GCSE%20Mathematics%20%282017%29/2024/GCSE%20Mathematics%20%282017%29-Summer2024-Report_0.pdf",
      "asked": "Write two algebraic fractions and a whole number as a single fraction.",
      "wentWrong": "Under a tenth got full marks. Most combined the two fractions but had no idea what to do with the whole number.",
      "fullMarkAnswersDid": "Wrote the whole number as (number x common denominator) / common denominator and combined all three numerators.",
      "rule": "A whole number is a fraction with denominator 1 - put it over the common denominator too.",
      "misconceptions": [
        "maths.alg-fractions.whole-number-term"
      ]
    },
    {
      "source": "ccea-cer:maths:2024-summer:M4:Q23",
      "url": "https://ccea.org.uk/downloads/docs/ExamMod-Reports/GCSE/GCSE%20Mathematics%20%282017%29/2024/GCSE%20Mathematics%20%282017%29-Summer2024-Report_0.pdf",
      "asked": "Solve an equation where the unknown is in the denominators.",
      "wentWrong": "About a fifth got full marks. Common denominator and cross-multiplying were known, but the constant term was mishandled, fractions were moved across with wrong signs, and tidying up went wrong; most still reached a quadratic for some credit.",
      "fullMarkAnswersDid": "Kept every term over one denominator, expanded carefully, and solved their quadratic (follow-through was available once most of the setup marks were earned and the roots were real).",
      "rule": "Clear the denominators in one line, then expand with brackets before simplifying.",
      "misconceptions": [
        "maths.algebra.bracket-expansion-sign"
      ]
    },
    {
      "source": "ccea-cer:maths:2024-november:M4:Q20",
      "url": "https://ccea.org.uk/downloads/docs/ExamMod-Reports/GCSE/GCSE%20Mathematics%20%282017%29/2024/GCSE%20Mathematics%20%282017%29-November2024-Report_0.pdf",
      "asked": "A standard fractional equation leading to a quadratic, with all the algebra on one side.",
      "wentWrong": "One in five got full marks; most got the first two marks, then made errors expanding brackets and handling the constants. Some again ignored the negative root.",
      "rule": "Write the expansion of every bracket as a separate line before collecting terms.",
      "misconceptions": [
        "maths.algebra.bracket-expansion-sign",
        "maths.quadratics.negative-root-discarded"
      ]
    },
    {
      "source": "ccea-cer:maths:2025-summer:M4:Q21",
      "url": "https://ccea.org.uk/downloads/docs/ExamMod-Reports/GCSE/GCSE%20Mathematics%20%282017%29/2025/GCSE%20Mathematics%20%282017%29-Summer2025-Report_0.pdf",
      "asked": "Add two algebraic fractions and simplify.",
      "wentWrong": "Most got the common denominator and the first line, then subtracted only the first term of a multi-term numerator, capping them at 3 marks.",
      "fullMarkAnswersDid": "Kept the subtracted numerator in brackets, expanded it fully with the sign applied to every term, then collected.",
      "rule": "Minus a bracket changes every sign inside it.",
      "misconceptions": [
        "maths.alg-fractions.subtract-multi-term-numerator"
      ]
    },
    {
      "source": "ccea-cer:maths:2025-november:M4:Q24",
      "url": "https://ccea.org.uk/downloads/docs/ExamMod-Reports/GCSE/GCSE%20Mathematics%20%282017%29/2025/GCSE%20Mathematics%20%282017%29-November2025-Report_0.pdf",
      "asked": "Solve a fractional equation with algebraic denominators.",
      "wentWrong": "Only top candidates finished; most set up the left-hand side correctly. Negative numbers caused trouble in expansions such as a multiple of (p - 1), and negative b was squared without brackets inside the quadratic formula.",
      "rule": "Type (-b) in brackets when squaring in the quadratic formula.",
      "misconceptions": [
        "maths.algebra.bracket-expansion-sign",
        "maths.quadratics.formula-b-squared-unbracketed"
      ]
    }
  ],
  "ruleToRemember": "Put every term - including whole numbers - over the common denominator, keep subtracted numerators in brackets, cross-multiply to a quadratic, then give both roots (rejecting one only with a reason) rounded at the very end.",
  "aStarSignal": "The unknown in two denominators with a constant elsewhere: cleared in one line, expanded without sign slips, and solved with the formula to 2 d.p. with both roots stated."
}
