{
  "id": "ins.fm.u2.velocity-time-graphs",
  "topic": "fm.u2.velocity-time-graphs",
  "specRefs": [
    "FM2-KIN-01"
  ],
  "findings": [
    {
      "source": "ccea-cer:further-maths:2022-summer:FM2:Q4",
      "url": "https://ccea.org.uk/downloads/docs/ExamMod-Reports/GCSE/GCSE%20Further%20Mathematics%20(2017)/2022/GCSE%20Further%20Mathematics%20(2017)-Summer2022-Report_0.pdf",
      "asked": "Velocity-time graph: distance from areas, then a time for a final stage.",
      "wentWrong": "Areas under segments earned marks widely; the final time was attempted with one constant-acceleration formula over the whole journey; the 18 s already elapsed was forgotten.",
      "rule": "Distance = area under the graph, segment by segment.",
      "misconceptions": [
        "fm.kin.head-start-ignored"
      ]
    },
    {
      "source": "ccea-cer:further-maths:2023-summer:FM2:Q6",
      "url": "https://ccea.org.uk/downloads/docs/ExamMod-Reports/GCSE/GCSE%20Further%20Mathematics%20(2017)/2023/GCSE%20Further%20Mathematics%20(2017)-Summer2023-Report_0.pdf",
      "asked": "Draw a second journey on a velocity-time graph; find when one catches the other.",
      "wentWrong": "A false origin of 10 s was accepted on the graph but then mishandled in the algebra; the 10 s head start was ignored; equations of motion were tried unsuccessfully instead of two distance expressions in T.",
      "fullMarkAnswersDid": "Wrote the two distances as expressions in T (areas), equated them, and solved.",
      "rule": "Equal distances at the catch-up time - write both areas in terms of T.",
      "misconceptions": [
        "fm.kin.head-start-ignored"
      ]
    },
    {
      "source": "ccea-cer:further-maths:2024-summer:FM2:Q1",
      "url": "https://ccea.org.uk/downloads/docs/ExamMod-Reports/GCSE/GCSE%20Further%20Mathematics%20(2017)/2024/GCSE%20Further%20Mathematics%20(2017)-Summer2024-Report_0.pdf",
      "asked": "Draw a displacement-time graph and find an average speed.",
      "wentWrong": "Weaker candidates could not draw the graph (extra parts, wrong heights); the average speed - a GCSE Maths skill - was poorly done: only the stronger used total distance over total time.",
      "rule": "Average speed = total distance / total time.",
      "misconceptions": [
        "fm.kin.average-speed-formula"
      ]
    }
  ],
  "ruleToRemember": "Area under a velocity-time graph is distance; equate distance expressions in T for catch-up problems and account for any head start; average speed is total distance over total time."
}
