{
  "id": "ins.fm.u1.optimisation",
  "topic": "fm.u1.optimisation",
  "specRefs": [
    "FM1-DIF-02"
  ],
  "findings": [
    {
      "source": "ccea-cer:further-maths:2018-summer:FM1:Q12",
      "url": "https://ccea.org.uk/downloads/docs/ExamMod-Reports/GCSE/GCSE%20Further%20Mathematics%20(2017)/2018/GCSE%20Further%20Mathematics%20(2017)-Summer2018-Report.pdf",
      "asked": "Show an expression, then optimise it in context.",
      "wentWrong": "In the 'show' part terms were added but not expanded step by step; few progressed in the calculus; some computed a different quantity (total shoppers) at the end.",
      "rule": "Show every line of a 'show that'; finish with the quantity asked.",
      "misconceptions": [
        "fm.show-that.steps-missing",
        "fm.optim.final-quantity-not-evaluated"
      ]
    },
    {
      "source": "ccea-cer:further-maths:2019-summer:FM1:Q14",
      "url": "https://ccea.org.uk/downloads/docs/ExamMod-Reports/GCSE/GCSE%20Further%20Mathematics%20(2017)/2019/GCSE%20Further%20Mathematics%20(2017)-Summer2019-Report.pdf",
      "asked": "Area and perimeter expressions, a constraint, then the maximum area.",
      "wentWrong": "Expressions were left unsimplified, causing later slips; many did not realise calculus was needed for the last part; some forgot to show the value was a maximum.",
      "rule": "Simplify each expression, differentiate, and confirm max/min with the second derivative.",
      "misconceptions": [
        "fm.optim.expression-not-simplified",
        "fm.optim.nature-not-shown"
      ]
    },
    {
      "source": "ccea-cer:further-maths:2022-summer:FM1:Q13",
      "url": "https://ccea.org.uk/downloads/docs/ExamMod-Reports/GCSE/GCSE%20Further%20Mathematics%20(2017)/2022/GCSE%20Further%20Mathematics%20(2017)-Summer2022-Report_0.pdf",
      "asked": "Form L from a diagram, then minimise it.",
      "wentWrong": "Many could not read L = x + 2y from the diagram; when differentiating, the x term's derivative (1) was omitted, giving x squared = 900 and x = 30; the answer 30 mm was given instead of the required L = 60 mm.",
      "rule": "Differentiate every term (x gives 1) and substitute back to find the quantity asked.",
      "misconceptions": [
        "fm.optim.constraint-not-read-from-diagram",
        "fm.calc.linear-term-derivative-omitted",
        "fm.optim.final-quantity-not-evaluated"
      ]
    },
    {
      "source": "ccea-cer:further-maths:2024-summer:FM1:Q13",
      "url": "https://ccea.org.uk/downloads/docs/ExamMod-Reports/GCSE/GCSE%20Further%20Mathematics%20(2017)/2024/GCSE%20Further%20Mathematics%20(2017)-Summer2024-Report_0.pdf",
      "asked": "An easier optimisation question.",
      "wentWrong": "Weaker candidates could not prove the two given results or apply them; most could differentiate the given expression.",
      "rule": "Even if the setup is lost, differentiate the printed expression for method marks.",
      "misconceptions": [
        "fm.show-that.steps-missing"
      ]
    },
    {
      "source": "ccea-cer:further-maths:2025-summer:FM1:Q14",
      "url": "https://ccea.org.uk/downloads/docs/ExamMod-Reports/GCSE/GCSE%20Further%20Mathematics%20(2017)/2025/GCSE%20Further%20Mathematics%20(2017)-Summer2025-Report_0.pdf",
      "asked": "Form expressions, then find and classify a stationary point.",
      "wentWrong": "Parts (i) and (ii) were strong. In (iii) the negative power of x was mishandled in the derivative and the resulting equation with fractional or negative exponents was hard to solve; the second derivative test was mostly done.",
      "rule": "Differentiate negative powers carefully and solve for x before classifying.",
      "misconceptions": [
        "fm.calc.negative-power-differentiation"
      ]
    }
  ],
  "ruleToRemember": "Build the expression from the constraint and simplify it; differentiate every term; set the derivative to zero and solve; use the second derivative to state max or min; then evaluate the quantity actually asked for.",
  "aStarSignal": "Reading the constraint from a diagram, handling a negative power in the derivative, and finishing with the optimised quantity rather than x."
}
