{
  "id": "ins.fm.u1.trig-graphs-sin-cos-tan",
  "topic": "fm.u1.trig-graphs-sin-cos-tan",
  "specRefs": [
    "FM1-TRG-01"
  ],
  "findings": [
    {
      "source": "ccea-cer:further-maths:2018-summer:FM1:Q3",
      "url": "https://ccea.org.uk/downloads/docs/ExamMod-Reports/GCSE/GCSE%20Further%20Mathematics%20(2017)/2018/GCSE%20Further%20Mathematics%20(2017)-Summer2018-Report.pdf",
      "asked": "Sketch the sine graph.",
      "wentWrong": "Correct points but sides drawn too straight; marks only for the points.",
      "rule": "Smooth curve, no straight segments.",
      "misconceptions": [
        "fm.trig.curve-too-straight"
      ]
    },
    {
      "source": "ccea-cer:further-maths:2019-summer:FM1:Q4",
      "url": "https://ccea.org.uk/downloads/docs/ExamMod-Reports/GCSE/GCSE%20Further%20Mathematics%20(2017)/2019/GCSE%20Further%20Mathematics%20(2017)-Summer2019-Report.pdf",
      "asked": "Sketch the cosine graph.",
      "wentWrong": "Curves too straight between max and min; too few values marked - the x-axis needs -90, 0, 90, 180, 270, 360 and the y-axis +1 and -1.",
      "rule": "Mark the key angles and the values plus and minus 1.",
      "misconceptions": [
        "fm.trig.curve-too-straight",
        "fm.trig.axes-not-marked"
      ]
    },
    {
      "source": "ccea-cer:further-maths:2022-summer:FM1:Q4",
      "url": "https://ccea.org.uk/downloads/docs/ExamMod-Reports/GCSE/GCSE%20Further%20Mathematics%20(2017)/2022/GCSE%20Further%20Mathematics%20(2017)-Summer2022-Report_0.pdf",
      "asked": "Sketch the sine curve.",
      "wentWrong": "No scales on the axes; some inverted the graph.",
      "rule": "Sine starts at the origin going up; label the axes.",
      "misconceptions": [
        "fm.trig.axes-not-marked"
      ]
    },
    {
      "source": "ccea-cer:further-maths:2023-summer:FM1:Q3",
      "url": "https://ccea.org.uk/downloads/docs/ExamMod-Reports/GCSE/GCSE%20Further%20Mathematics%20(2017)/2023/GCSE%20Further%20Mathematics%20(2017)-Summer2023-Report_0.pdf",
      "asked": "Sketch cosine between -180 and 180.",
      "wentWrong": "The turning points at plus and minus 180 were not shown - sketches ran straight off below -1; the y-axis had no scale.",
      "rule": "Cosine turns at plus or minus 180 with value -1.",
      "misconceptions": [
        "fm.trig.curve-too-straight",
        "fm.trig.axes-not-marked"
      ]
    },
    {
      "source": "ccea-cer:further-maths:2025-summer:FM1:Q2",
      "url": "https://ccea.org.uk/downloads/docs/ExamMod-Reports/GCSE/GCSE%20Further%20Mathematics%20(2017)/2025/GCSE%20Further%20Mathematics%20(2017)-Summer2025-Report_0.pdf",
      "asked": "Sketch y = tan x.",
      "wentWrong": "Asymptotes were omitted or placed at 180; curves touched or crossed them; the x-axis was unlabelled; some drew sine-like shapes.",
      "rule": "Tan has asymptotes at 90 and 270; the curve approaches them but never touches.",
      "misconceptions": [
        "fm.trig.tan-asymptotes",
        "fm.trig.axes-not-marked"
      ]
    }
  ],
  "ruleToRemember": "Sketch a smooth curve with the key angles and plus or minus 1 marked; tan needs vertical asymptotes at 90 and 270 that the curve never touches."
}
