{
  "id": "ins.maths.m6.linear-inequalities-in-one-variable",
  "topic": "maths.m6.linear-inequalities-in-one-variable",
  "specRefs": [
    "M6-NA-05"
  ],
  "findings": [
    {
      "source": "ccea-cer:maths:2023-summer:M72:Q8",
      "url": "https://ccea.org.uk/downloads/docs/ExamMod-Reports/GCSE/GCSE%20Mathematics%20%282017%29/2023/GCSE%20Mathematics%20%282017%29-Summer2023-Report_0.pdf",
      "asked": "Solve a linear inequality.",
      "wentWrong": "Those who replaced the sign with = often forgot to put it back; some with x > -3 wrote only -3 on the answer line.",
      "rule": "Keep the inequality sign on every line including the answer.",
      "misconceptions": [
        "maths.inequality.sign-dropped-final-answer"
      ]
    },
    {
      "source": "ccea-cer:maths:2024-summer:M81:Q1",
      "url": "https://ccea.org.uk/downloads/docs/ExamMod-Reports/GCSE/GCSE%20Mathematics%20%282017%29/2024/GCSE%20Mathematics%20%282017%29-Summer2024-Report_0.pdf",
      "asked": "Write and solve an inequality from information.",
      "wentWrong": "Over a quarter could not write the inequality; many lost the sign during the working and answered with an equals.",
      "rule": "An inequality's answer is a range, written with < or >.",
      "misconceptions": [
        "maths.inequality.sign-dropped-final-answer"
      ]
    },
    {
      "source": "ccea-cer:maths:2024-november:M72:Q13",
      "url": "https://ccea.org.uk/downloads/docs/ExamMod-Reports/GCSE/GCSE%20Mathematics%20%282017%29/2024/GCSE%20Mathematics%20%282017%29-November2024-Report_0.pdf",
      "asked": "Solve and show integer solutions on a number line.",
      "wentWrong": "Not well done; a mark for dividing by 2; those who got there drew a line rather than marking the integer values; most drew a line from -5 to 8.",
      "rule": "Integer solutions are dots, not a continuous line.",
      "misconceptions": [
        "maths.inequality.integer-values-vs-line"
      ]
    },
    {
      "source": "ccea-cer:maths:2025-summer:M72:Q11",
      "url": "https://ccea.org.uk/downloads/docs/ExamMod-Reports/GCSE/GCSE%20Mathematics%20%282017%29/2025/GCSE%20Mathematics%20%282017%29-Summer2025-Report_0.pdf",
      "asked": "Solve an inequality with a bracket.",
      "wentWrong": "x = 6 (or 0.833) instead of an inequality lost a mark; 6x < 5 became x < 1.2 by dividing the wrong way; 6x + 1 came from not multiplying the 1 by 3.",
      "rule": "Divide the constant by the coefficient, and keep the sign.",
      "misconceptions": [
        "maths.inequality.sign-dropped-final-answer",
        "maths.inequality.divide-wrong-way",
        "maths.algebra.bracket-expansion-sign"
      ]
    },
    {
      "source": "ccea-cer:maths:2025-summer:M82:Q5",
      "url": "https://ccea.org.uk/downloads/docs/ExamMod-Reports/GCSE/GCSE%20Mathematics%20%282017%29/2025/GCSE%20Mathematics%20%282017%29-Summer2025-Report_0.pdf",
      "asked": "Solve an inequality.",
      "wentWrong": "Nearly 70% correct; the rest solved as an equation and forgot to restore the sign, or slipped numerically.",
      "rule": "Never convert to an equation.",
      "misconceptions": [
        "maths.inequality.sign-dropped-final-answer"
      ]
    },
    {
      "source": "ccea-cer:maths:2025-november:M72:Q11",
      "url": "https://ccea.org.uk/downloads/docs/ExamMod-Reports/GCSE/GCSE%20Mathematics%20%282017%29/2025/GCSE%20Mathematics%20%282017%29-November2025-Report_0.pdf",
      "asked": "Solve an inequality.",
      "wentWrong": "Many reached x < 0.75 but wrote x = 0.75; some divided 4 by 3 instead of 3 by 4.",
      "rule": "The answer line must read x < ... (or >).",
      "misconceptions": [
        "maths.inequality.sign-dropped-final-answer",
        "maths.inequality.divide-wrong-way"
      ]
    },
    {
      "source": "ccea-cer:maths:2025-november:M82:Q3",
      "url": "https://ccea.org.uk/downloads/docs/ExamMod-Reports/GCSE/GCSE%20Mathematics%20%282017%29/2025/GCSE%20Mathematics%20%282017%29-November2025-Report_0.pdf",
      "asked": "Solve an inequality.",
      "wentWrong": "Two thirds correct; the common error was solving the equation and not reintroducing the sign.",
      "rule": "Carry the sign through every line.",
      "misconceptions": [
        "maths.inequality.sign-dropped-final-answer"
      ]
    }
  ],
  "ruleToRemember": "Solve like an equation but keep the inequality sign on every line; the answer is x < ... or x > ...; if integer values are asked, list or dot them rather than drawing a line.",
  "aStarSignal": "A double inequality or one with a bracket solved with the sign intact and the integer set stated correctly."
}
