{
  "id": "ins.science.b2.monohybrid-genetics",
  "topic": "science.b2.monohybrid-genetics",
  "specRefs": [
    "DA-B2-2.4.8"
  ],
  "findings": [
    {
      "source": "ccea-cer:science:2024-summer:B2H:Q11",
      "url": "https://ccea.org.uk/downloads/docs/ExamMod-Reports/GCSE/GCSE%20Science%20Double%20Award%20%282017%29/2024/GCSE%20Science%20Double%20Award%20%282017%29-Summer2024-Report_0.pdf",
      "asked": "A pedigree of an inherited condition: the exact relationship between two people, a genotype from the key, a carrier probability, the complete phenotype of one person, then a Punnett square for two named parents.",
      "wentWrong": "The relationship had to be exact ('father', not 'parent'); answers that read past the bold word 'complete' named the condition without the sex; and the Punnett square - examined many times before - was still completed wrongly by a large number, though a correct cross from wrong gametes earned error-carried-forward marks.",
      "fullMarkAnswersDid": "Gave the phenotype in full, sex and condition together, and set out the parents' gametes before filling the square.",
      "rule": "A bold word in a genetics stem changes the answer: a complete phenotype names the sex as well as the condition. Genotypes, then gametes, then the square.",
      "misconceptions": [
        "sci.genetics.bold-word-ignored",
        "sci.genetics.parental-genotype-wrong"
      ]
    },
    {
      "source": "ccea-cer:science:2025-summer:B2H:Q8",
      "url": "https://ccea.org.uk/downloads/docs/ExamMod-Reports/GCSE/GCSE%20Science%20Double%20Award%20%282017%29/2025/GCSE%20Science%20Double%20Award%20%282017%29-Summer2025-Report_0.pdf",
      "asked": "Complete a two-generation inheritance diagram (parents, gametes, first and second generations), then describe a test (back) cross for an animal of unknown genotype.",
      "wentWrong": "Some began from the wrong parental genotype and lost marks as a result; only the more able could describe how to carry out a test cross.",
      "rule": "A test cross uses a homozygous recessive partner: any recessive offspring proves the unknown parent is heterozygous.",
      "misconceptions": [
        "sci.genetics.parental-genotype-wrong",
        "sci.genetics.test-cross-unknown"
      ]
    },
    {
      "source": "ccea-cer:science:2025-summer:B2F:Q4",
      "url": "https://ccea.org.uk/downloads/docs/ExamMod-Reports/GCSE/GCSE%20Science%20Double%20Award%20%282017%29/2025/GCSE%20Science%20Double%20Award%20%282017%29-Summer2025-Report_0.pdf",
      "asked": "State the genotype terms for given allele pairs, draw a Punnett square and give a percentage.",
      "wentWrong": "Surprisingly few could write 'homozygous dominant' and 'homozygous recessive'; the square itself was mostly right (three of four marks common) and quite a few found the 50%.",
      "rule": "Homozygous = two identical alleles (dominant or recessive); heterozygous = one of each.",
      "misconceptions": [
        "sci.genetics.terms-homozygous-heterozygous"
      ]
    },
    {
      "source": "ccea-cer:science:2024-summer:B2F:Q5",
      "url": "https://ccea.org.uk/downloads/docs/ExamMod-Reports/GCSE/GCSE%20Science%20Double%20Award%20%282017%29/2024/GCSE%20Science%20Double%20Award%20%282017%29-Summer2024-Report_0.pdf",
      "asked": "Parental genotypes and alleles, then choose the correct Punnett squares from options.",
      "wentWrong": "Genotypes were given by quite a few but the alleles by fewer; the unfamiliar 'choose the square' format was managed only by the better candidates.",
      "rule": "An allele is one letter; a genotype is the pair.",
      "misconceptions": [
        "sci.genetics.terms-homozygous-heterozygous"
      ]
    }
  ],
  "ruleToRemember": "Write the parents' genotypes first (obey the bold words), then their gametes, then the square, then count the ratio or percentage the question asks for. Homozygous = two identical alleles, heterozygous = different; a test cross uses a homozygous recessive partner.",
  "aStarSignal": "Correct genotypes from a pedigree with the reasoning stated, then a test cross explained in terms of what the offspring would reveal."
}
