{
  "id": "ins.maths.m7.changing-the-subject-harder-formulae",
  "topic": "maths.m7.changing-the-subject-harder-formulae",
  "specRefs": [
    "M7-NA-07"
  ],
  "findings": [
    {
      "source": "ccea-cer:maths:2024-november:M71:Q17",
      "url": "https://ccea.org.uk/downloads/docs/ExamMod-Reports/GCSE/GCSE%20Mathematics%20%282017%29/2024/GCSE%20Mathematics%20%282017%29-November2024-Report_0.pdf",
      "asked": "Make a variable the subject when it is squared inside a formula.",
      "wentWrong": "Square roots were taken before dividing by A, or the root sign covered only the numerator; some started with B - A.",
      "rule": "Isolate the squared term completely, then root the whole of both sides.",
      "misconceptions": [
        "maths.subject.root-before-isolating"
      ]
    },
    {
      "source": "ccea-cer:maths:2024-november:M81:Q9",
      "url": "https://ccea.org.uk/downloads/docs/ExamMod-Reports/GCSE/GCSE%20Mathematics%20%282017%29/2024/GCSE%20Mathematics%20%282017%29-November2024-Report_0.pdf",
      "asked": "Change the subject of a formula.",
      "wentWrong": "Over 20% could not even divide both sides by A.",
      "rule": "Undo operations in reverse order, one per line.",
      "misconceptions": [
        "maths.subject.root-before-isolating"
      ]
    },
    {
      "source": "ccea-cer:maths:2025-summer:M72:Q13",
      "url": "https://ccea.org.uk/downloads/docs/ExamMod-Reports/GCSE/GCSE%20Mathematics%20%282017%29/2025/GCSE%20Mathematics%20%282017%29-Summer2025-Report_0.pdf",
      "asked": "Make x the subject when x appears twice.",
      "wentWrong": "Few finished; a mark for reaching 4y = 5x - vx; many had no idea x had to be collected and left it on both sides.",
      "fullMarkAnswersDid": "Collected the x terms on one side, factorised x out, divided by the bracket.",
      "rule": "Subject twice: collect, factorise, divide.",
      "misconceptions": [
        "maths.subject.subject-appears-twice-not-collected"
      ]
    },
    {
      "source": "ccea-cer:maths:2025-summer:M82:Q6",
      "url": "https://ccea.org.uk/downloads/docs/ExamMod-Reports/GCSE/GCSE%20Mathematics%20%282017%29/2025/GCSE%20Mathematics%20%282017%29-Summer2025-Report_0.pdf",
      "asked": "Change the subject where the subject appears twice.",
      "wentWrong": "Under half full marks; over a third never gathered the x terms to one side.",
      "rule": "First move: every term containing the subject to one side.",
      "misconceptions": [
        "maths.subject.subject-appears-twice-not-collected"
      ]
    },
    {
      "source": "ccea-cer:maths:2023-summer:M72:Q10",
      "url": "https://ccea.org.uk/downloads/docs/ExamMod-Reports/GCSE/GCSE%20Mathematics%20%282017%29/2023/GCSE%20Mathematics%20%282017%29-Summer2023-Report_0.pdf",
      "asked": "Binary conversion, then change the subject.",
      "wentWrong": "Steps were skipped; a mark was available for the intermediate line 3m = h - y.",
      "rule": "Show every rearrangement line.",
      "misconceptions": []
    }
  ],
  "ruleToRemember": "Collect every term containing the subject on one side, factorise the subject out, divide by the bracket; undo powers last, applying the root to the whole side.",
  "aStarSignal": "A formula with the subject appearing twice and inside a power, rearranged in a clean sequence of single steps."
}
