{
  "id": "ins.maths.m7.recognising-and-sketching-linear-quadratic-cubic-and-reciprocal-graphs",
  "topic": "maths.m7.recognising-and-sketching-linear-quadratic-cubic-and-reciprocal-graphs",
  "specRefs": [
    "M7-NA-09"
  ],
  "findings": [
    {
      "source": "ccea-cer:maths:2024-november:M71:Q16",
      "url": "https://ccea.org.uk/downloads/docs/ExamMod-Reports/GCSE/GCSE%20Mathematics%20%282017%29/2024/GCSE%20Mathematics%20%282017%29-November2024-Report_0.pdf",
      "asked": "Draw a reciprocal graph from a table.",
      "wentWrong": "Many drew a straight line; others plotted correctly but ignored the point at (0.5, 12) and started at (1, 6), so the curve did not extend far enough.",
      "rule": "A reciprocal graph is a curve that steepens near the axis; include every point.",
      "misconceptions": [
        "maths.graphs.reciprocal-drawn-as-line"
      ]
    },
    {
      "source": "ccea-cer:maths:2024-november:M81:Q11",
      "url": "https://ccea.org.uk/downloads/docs/ExamMod-Reports/GCSE/GCSE%20Mathematics%20%282017%29/2024/GCSE%20Mathematics%20%282017%29-November2024-Report_0.pdf",
      "asked": "Sketch a reciprocal-type graph and interpret it.",
      "wentWrong": "Most scored some marks, but only the best drew an acceptable part to the left of (1, 6) - many joined to the y-axis or left it blank.",
      "rule": "The curve approaches the axes but never touches them.",
      "misconceptions": [
        "maths.graphs.reciprocal-drawn-as-line"
      ]
    },
    {
      "source": "ccea-cer:maths:2024-summer:M81:Q13",
      "url": "https://ccea.org.uk/downloads/docs/ExamMod-Reports/GCSE/GCSE%20Mathematics%20%282017%29/2024/GCSE%20Mathematics%20%282017%29-Summer2024-Report_0.pdf",
      "asked": "Match four equations to their graphs.",
      "wentWrong": "Nearly all matched some; over a third matched all four.",
      "rule": "Know the shapes: line, U or n parabola, S-shaped cubic, two-branch reciprocal.",
      "misconceptions": []
    }
  ],
  "ruleToRemember": "Recognise the four shapes; a reciprocal graph has two branches that approach but never touch the axes, so extend the curve beyond the first and last plotted points."
}
