{
  "id": "ins.fm.u3.linear-transformation-mean-sd",
  "topic": "fm.u3.linear-transformation-mean-sd",
  "specRefs": [
    "FM3-CTD-03"
  ],
  "findings": [
    {
      "source": "ccea-cer:further-maths:2024-summer:FM3:Q1",
      "url": "https://ccea.org.uk/downloads/docs/ExamMod-Reports/GCSE/GCSE%20Further%20Mathematics%20(2017)/2024/GCSE%20Further%20Mathematics%20(2017)-Summer2024-Report_0.pdf",
      "asked": "Mean and SD, then the effect of adding 3 to every value.",
      "wentWrong": "The fx column was squared instead of f x squared; adding 3 was applied to the SD as well as the mean.",
      "rule": "Adding a constant moves the mean and leaves the SD unchanged; multiplying scales both.",
      "misconceptions": [
        "fm.sd.sum-squared-vs-sum-of-squares",
        "fm.sd.transformation-added-to-sd"
      ]
    },
    {
      "source": "ccea-cer:further-maths:2023-summer:FM3:Q6",
      "url": "https://ccea.org.uk/downloads/docs/ExamMod-Reports/GCSE/GCSE%20Further%20Mathematics%20(2017)/2023/GCSE%20Further%20Mathematics%20(2017)-Summer2023-Report_0.pdf",
      "asked": "SD of five marks, then scaling with y = mx + n.",
      "wentWrong": "About a third got only the mean mark; just over half handled the scaling - strange equations in m and n appeared.",
      "rule": "New mean = m x old mean + n; new SD = m x old SD.",
      "misconceptions": [
        "fm.sd.transformation-added-to-sd"
      ]
    }
  ],
  "ruleToRemember": "For y = mx + n: mean of y = m(mean of x) + n and SD of y = m(SD of x) - the added constant never touches the spread."
}
