{
  "id": "ins.science.p1.work-and-power",
  "topic": "science.p1.work-and-power",
  "specRefs": [
    "DA-P1-1.4.13",
    "DA-P1-1.4.14",
    "DA-P1-1.4.15",
    "DA-P1-1.4.16",
    "DA-PRAC-P4"
  ],
  "findings": [
    {
      "source": "ccea-cer:science:2025-summer:P1F:Q9",
      "url": "https://ccea.org.uk/downloads/docs/ExamMod-Reports/GCSE/GCSE%20Science%20Double%20Award%20%282017%29/2025/GCSE%20Science%20Double%20Award%20%282017%29-Summer2025-Report_0.pdf",
      "asked": "Work done pulling a box, define power, then find a time from power and work.",
      "wentWrong": "Only a minority recalled work = force x distance; the definition of power was explained as energy, force or strength; the time calculation went better.",
      "rule": "Power is the rate of doing work - work done (or energy transferred) per second.",
      "misconceptions": [
        "sci.energy.power-defined-as-energy-or-force"
      ]
    },
    {
      "source": "ccea-cer:science:2025-summer:P1H:Q4",
      "url": "https://ccea.org.uk/downloads/docs/ExamMod-Reports/GCSE/GCSE%20Science%20Double%20Award%20%282017%29/2025/GCSE%20Science%20Double%20Award%20%282017%29-Summer2025-Report_0.pdf",
      "asked": "The same box-up-a-slope question at Higher.",
      "wentWrong": "Work done was right (500 J), but the power definition was the hardest part of the whole paper: candidates knew it involved energy or work and time but did not link them as a rate.",
      "rule": "Definition = work done divided by time taken; say 'per second' or 'rate'.",
      "misconceptions": [
        "sci.energy.power-defined-as-energy-or-force"
      ]
    },
    {
      "source": "ccea-cer:science:2024-summer:P1H:Q6",
      "url": "https://ccea.org.uk/downloads/docs/ExamMod-Reports/GCSE/GCSE%20Science%20Double%20Award%20%282017%29/2024/GCSE%20Science%20Double%20Award%20%282017%29-Summer2024-Report_0.pdf",
      "asked": "Work done by a forklift lifting a load, then the time taken at a given power.",
      "wentWrong": "The method was known but many kept the distance in centimetres and lost two of the four marks.",
      "rule": "Distance in metres before you multiply.",
      "misconceptions": [
        "sci.physics.length-not-in-metres"
      ]
    }
  ],
  "ruleToRemember": "Work done = force x distance moved in the direction of the force (J, with distance in m). Power = work done (or energy transferred) divided by time - the rate of doing work, in watts. Definitions need the 'per unit time' idea, not just the words energy and time.",
  "aStarSignal": "Defining power as a rate in one sentence and using P = W/t to find a time, with units converted first."
}
