{
  "id": "ins.fm.u1.trig-equations",
  "topic": "fm.u1.trig-equations",
  "specRefs": [
    "FM1-TRG-02"
  ],
  "findings": [
    {
      "source": "ccea-cer:further-maths:2018-summer:FM1:Q3",
      "url": "https://ccea.org.uk/downloads/docs/ExamMod-Reports/GCSE/GCSE%20Further%20Mathematics%20(2017)/2018/GCSE%20Further%20Mathematics%20(2017)-Summer2018-Report.pdf",
      "asked": "Solve a trig equation in a range.",
      "wentWrong": "First-part wrong answers (60 and 300) were common; the CAST diagram with a negative value caused difficulty; algebra to isolate x undid correct values.",
      "rule": "Solve for the bracket first, find all angles from CAST, then isolate x.",
      "misconceptions": [
        "fm.trig.cast-with-negative-value",
        "fm.trig.second-solution-missing"
      ]
    },
    {
      "source": "ccea-cer:further-maths:2019-summer:FM1:Q4",
      "url": "https://ccea.org.uk/downloads/docs/ExamMod-Reports/GCSE/GCSE%20Further%20Mathematics%20(2017)/2019/GCSE%20Further%20Mathematics%20(2017)-Summer2019-Report.pdf",
      "asked": "Solve a trig equation with a negative value; give solutions in range.",
      "wentWrong": "0.184 used instead of -0.184; both angles from (i) were followed through into (ii) giving a solution outside the range.",
      "rule": "Check every candidate solution against the stated range.",
      "misconceptions": [
        "fm.trig.answer-outside-range"
      ]
    },
    {
      "source": "ccea-cer:further-maths:2022-summer:FM1:Q4",
      "url": "https://ccea.org.uk/downloads/docs/ExamMod-Reports/GCSE/GCSE%20Further%20Mathematics%20(2017)/2022/GCSE%20Further%20Mathematics%20(2017)-Summer2022-Report_0.pdf",
      "asked": "Solve a trig equation in a given range.",
      "wentWrong": "Most found the basic angle (53.13) and stopped; the sketch from part (a) was not used to locate the other angles; part (ii) follow-through only.",
      "rule": "Use the sketch to see how many solutions the range contains.",
      "misconceptions": [
        "fm.trig.second-solution-missing"
      ]
    },
    {
      "source": "ccea-cer:further-maths:2023-summer:FM1:Q3",
      "url": "https://ccea.org.uk/downloads/docs/ExamMod-Reports/GCSE/GCSE%20Further%20Mathematics%20(2017)/2023/GCSE%20Further%20Mathematics%20(2017)-Summer2023-Report_0.pdf",
      "asked": "Solve a cosine equation.",
      "wentWrong": "Some used cos inverse of 2/3 and got plus or minus 48.19 with the wrong sign; in (ii) dividing by 2 instead of multiplying.",
      "rule": "Keep the sign of the ratio and undo the bracket in the correct order.",
      "misconceptions": [
        "fm.trig.answer-outside-range",
        "fm.trig.transform-order"
      ]
    },
    {
      "source": "ccea-cer:further-maths:2024-summer:FM1:Q4",
      "url": "https://ccea.org.uk/downloads/docs/ExamMod-Reports/GCSE/GCSE%20Further%20Mathematics%20(2017)/2024/GCSE%20Further%20Mathematics%20(2017)-Summer2024-Report_0.pdf",
      "asked": "Solve a trig equation with a transformed argument.",
      "wentWrong": "The second angle was found by most; the common slip was multiplying by 2 and then adding 20 instead of the reverse order.",
      "rule": "If the argument is (2x + 20), subtract 20 first, then divide by 2.",
      "misconceptions": [
        "fm.trig.transform-order"
      ]
    },
    {
      "source": "ccea-cer:further-maths:2025-summer:FM1:Q2",
      "url": "https://ccea.org.uk/downloads/docs/ExamMod-Reports/GCSE/GCSE%20Further%20Mathematics%20(2017)/2025/GCSE%20Further%20Mathematics%20(2017)-Summer2025-Report_0.pdf",
      "asked": "Solve tan x = 6 in a range, then use it.",
      "wentWrong": "tan inverse gave 80.54 and many stopped; some added or subtracted from 90 and left the range; follow-through was available in (ii).",
      "rule": "For tan, the second solution is 180 more.",
      "misconceptions": [
        "fm.trig.second-solution-missing",
        "fm.trig.answer-outside-range"
      ]
    }
  ],
  "ruleToRemember": "Find the basic angle, use CAST or the sketch to list every solution of the bracket in the range, then undo the bracket in reverse order; discard anything outside the range.",
  "aStarSignal": "A negative ratio with a transformed argument, solved with every solution in range and none outside it."
}
