{
  "id": "ins.maths.m3.box-plots-and-comparing-distributions",
  "topic": "maths.m3.box-plots-and-comparing-distributions",
  "specRefs": [
    "M3-HD-03",
    "M3-HD-04"
  ],
  "findings": [
    {
      "source": "ccea-cer:maths:2023-summer:M3:Q25",
      "url": "https://ccea.org.uk/downloads/docs/ExamMod-Reports/GCSE/GCSE%20Mathematics%20%282017%29/2023/GCSE%20Mathematics%20%282017%29-Summer2023-Report_0.pdf",
      "asked": "Use given information (some indirect) to draw a box plot, then interpret it.",
      "wentWrong": "The strongest worked out the minimum (3) and the upper quartile (20) from the clues and drew accurately; many got the minimum only; weaker candidates plotted the five numbers as printed. The reasoning mark came from the median being 14.",
      "rule": "Some of the five values must be calculated from the clues before drawing.",
      "misconceptions": [
        "maths.boxplot.plot-given-values-uncalculated"
      ]
    },
    {
      "source": "ccea-cer:maths:2023-summer:M4:Q14",
      "url": "https://ccea.org.uk/downloads/docs/ExamMod-Reports/GCSE/GCSE%20Mathematics%20%282017%29/2023/GCSE%20Mathematics%20%282017%29-Summer2023-Report_0.pdf",
      "asked": "Draw a box plot and interpret it.",
      "wentWrong": "Most found the minimum but struggled with the upper quartile of 20; some drew without a ruler. Interpretation via the median was fine.",
      "rule": "Ruler, five correct values, then reason from the median.",
      "misconceptions": [
        "maths.boxplot.plot-given-values-uncalculated",
        "maths.boxplot.faint-or-extra-lines"
      ]
    },
    {
      "source": "ccea-cer:maths:2025-november:M3:Q26",
      "url": "https://ccea.org.uk/downloads/docs/ExamMod-Reports/GCSE/GCSE%20Mathematics%20%282017%29/2025/GCSE%20Mathematics%20%282017%29-November2025-Report_0.pdf",
      "asked": "Box plot needing two values calculated first; then explain why the IQR suits this data.",
      "wentWrong": "Over half plotted the five printed numbers with no calculation. The explanation was the worst-answered item on the paper: generic contrasts of range and IQR did not score; the mark needed the observation that the range was inflated by the one very high value (98%).",
      "rule": "A reason must point at the feature of this data set.",
      "misconceptions": [
        "maths.boxplot.plot-given-values-uncalculated",
        "maths.stats.generic-reason-not-data-specific",
        "maths.boxplot.faint-or-extra-lines"
      ]
    },
    {
      "source": "ccea-cer:maths:2025-november:M4:Q11",
      "url": "https://ccea.org.uk/downloads/docs/ExamMod-Reports/GCSE/GCSE%20Mathematics%20%282017%29/2025/GCSE%20Mathematics%20%282017%29-November2025-Report_0.pdf",
      "asked": "Box plot with two values to calculate; explain why the IQR is more suitable.",
      "wentWrong": "Common part-scores: minimum right but 30 taken as the LQ, or LQ right with minimum taken as 0. Extra lines inside the box and very faint pencil were noted. Only 9% earned the explanation mark - generic answers about extremes were not enough.",
      "rule": "Draw dark, clean lines; cite the extreme value in the data.",
      "misconceptions": [
        "maths.boxplot.plot-given-values-uncalculated",
        "maths.boxplot.faint-or-extra-lines",
        "maths.stats.generic-reason-not-data-specific"
      ]
    }
  ],
  "ruleToRemember": "Work out any missing statistics from the clues before drawing; draw dark, clean lines; compare with one average and one spread statement in context; a 'why' answer must name the feature of the given data.",
  "aStarSignal": "Turning indirect clues into the five values and then arguing from the specific outlier why the IQR is the better measure."
}
