{
  "id": "ins.maths.m3.solving-quadratic-equations-by-factorising",
  "topic": "maths.m3.solving-quadratic-equations-by-factorising",
  "specRefs": [
    "M3-NA-11"
  ],
  "findings": [
    {
      "source": "ccea-cer:maths:2023-summer:M4:Q10",
      "url": "https://ccea.org.uk/downloads/docs/ExamMod-Reports/GCSE/GCSE%20Mathematics%20%282017%29/2023/GCSE%20Mathematics%20%282017%29-Summer2023-Report_0.pdf",
      "asked": "Factorise a quadratic, then solve the linked equation.",
      "wentWrong": "Factorising was excellent (a few sign mix-ups). The solving part was very poor: most did not connect it with (a), and many who did wrote only the positive root.",
      "rule": "Each bracket = 0 gives one solution; report both.",
      "misconceptions": [
        "maths.quadratics.no-link-between-parts",
        "maths.quadratics.negative-root-discarded"
      ]
    },
    {
      "source": "ccea-cer:maths:2023-summer:M3:Q21",
      "url": "https://ccea.org.uk/downloads/docs/ExamMod-Reports/GCSE/GCSE%20Mathematics%20%282017%29/2023/GCSE%20Mathematics%20%282017%29-Summer2023-Report_0.pdf",
      "asked": "Factorise, then solve.",
      "wentWrong": "Factorising was right or wrong outright. Very few used it to solve; most offered x = 5 alone, found by trial.",
      "rule": "Use your factorised form - it is the method the mark scheme rewards.",
      "misconceptions": [
        "maths.quadratics.no-link-between-parts",
        "maths.quadratics.negative-root-discarded"
      ]
    },
    {
      "source": "ccea-cer:maths:2024-summer:M3:Q28",
      "url": "https://ccea.org.uk/downloads/docs/ExamMod-Reports/GCSE/GCSE%20Mathematics%20%282017%29/2024/GCSE%20Mathematics%20%282017%29-Summer2024-Report_0.pdf",
      "asked": "Set up a quadratic from the information, then solve it.",
      "wentWrong": "Only a handful set up the equation; many just solved the printed one, and some who factorised correctly listed only one solution.",
      "rule": "Two brackets, two solutions, both on the answer line.",
      "misconceptions": [
        "maths.quadratics.show-that-solve-instead",
        "maths.quadratics.negative-root-discarded"
      ]
    },
    {
      "source": "ccea-cer:maths:2025-summer:M4:Q10",
      "url": "https://ccea.org.uk/downloads/docs/ExamMod-Reports/GCSE/GCSE%20Mathematics%20%282017%29/2025/GCSE%20Mathematics%20%282017%29-Summer2025-Report_0.pdf",
      "asked": "Factorise (common factor, then difference of two squares), then solve a simple quadratic.",
      "wentWrong": "Taking out only 4 instead of 4a scored nothing for the first part. In the solving part weaker candidates rearranged as if the equation were linear, and some dropped the negative root.",
      "rule": "A quadratic is solved by factorising or the formula, never by moving terms like a linear equation.",
      "misconceptions": [
        "maths.factorising.not-fully-factorised",
        "maths.quadratics.treat-as-linear",
        "maths.quadratics.negative-root-discarded"
      ]
    },
    {
      "source": "ccea-cer:maths:2025-november:M3:Q28",
      "url": "https://ccea.org.uk/downloads/docs/ExamMod-Reports/GCSE/GCSE%20Mathematics%20%282017%29/2025/GCSE%20Mathematics%20%282017%29-November2025-Report_0.pdf",
      "asked": "Factorise a quadratic in c.",
      "wentWrong": "About a third succeeded; many did not see the need for two brackets, signs were muddled (-12c and +27), and some wrote the brackets in x.",
      "rule": "Use the letter in the question and check the signs multiply back correctly.",
      "misconceptions": [
        "maths.factorising.sign-errors-in-brackets",
        "maths.factorising.wrong-variable-letter"
      ]
    },
    {
      "source": "ccea-cer:maths:2025-november:M4:Q13",
      "url": "https://ccea.org.uk/downloads/docs/ExamMod-Reports/GCSE/GCSE%20Mathematics%20%282017%29/2025/GCSE%20Mathematics%20%282017%29-November2025-Report_0.pdf",
      "asked": "Factorise a quadratic in c, then a difference of two squares.",
      "wentWrong": "Well done overall, but using x instead of c cost a mark and any wrong sign cost both.",
      "rule": "Same letter as the question; signs must reproduce the middle term.",
      "misconceptions": [
        "maths.factorising.wrong-variable-letter",
        "maths.factorising.sign-errors-in-brackets"
      ]
    }
  ],
  "ruleToRemember": "Factorise, set each bracket equal to zero, and give both solutions in the variable the question uses; part (b) almost always uses part (a).",
  "aStarSignal": "Choosing factorising over trial when a quadratic appears inside a longer problem, and stating both roots before selecting the one the context needs."
}
