{
  "id": "ins.science.u7.planning",
  "topic": "science.u7.planning",
  "specRefs": [
    "DA-U7-plan-1",
    "DA-U7-plan-4",
    "DA-U7-plan-5",
    "DA-U7-plan-7"
  ],
  "findings": [
    {
      "source": "ccea-cer:science:2024-summer:U7BChemH:Q2",
      "url": "https://ccea.org.uk/downloads/docs/ExamMod-Reports/GCSE/GCSE%20Science%20Double%20Award%20%282017%29/2024/GCSE%20Science%20Double%20Award%20%282017%29-Summer2024-Report_0.pdf",
      "asked": "Draw the apparatus for a distillation, name the round-bottom flask and condenser, explain the water flow and the thermometer position.",
      "wentWrong": "Diagrams were very poor: two different diagrams offered, sealed-off funnels, apparatus that could not work, no labels; the flask and condenser were unfamiliar and the reasons for the water flow and thermometer position were rarely right - the practical had clearly not been seen.",
      "rule": "Know the standard apparatus by name and by drawing before the exam; a diagram must work.",
      "misconceptions": [
        "sci.practical.3d-or-blocked-apparatus-diagram",
        "sci.practical.apparatus-names-unknown"
      ]
    },
    {
      "source": "ccea-cer:science:2025-summer:U7BChemH:Q2",
      "url": "https://ccea.org.uk/downloads/docs/ExamMod-Reports/GCSE/GCSE%20Science%20Double%20Award%20%282017%29/2025/GCSE%20Science%20Double%20Award%20%282017%29-Summer2025-Report_0.pdf",
      "asked": "Draw the assembled apparatus for collecting gas from marble chips and acid.",
      "wentWrong": "Generally good, but examiners want a two-dimensional cross-section with a clear path for gas: a line drawn across the end of a tube or a stopper counts as a blockage, and each piece must be recognisable.",
      "rule": "2-D, open paths, every piece recognisable and labelled.",
      "misconceptions": [
        "sci.practical.3d-or-blocked-apparatus-diagram"
      ]
    },
    {
      "source": "ccea-cer:science:2024-summer:U7BPhysH:Q4",
      "url": "https://ccea.org.uk/downloads/docs/ExamMod-Reports/GCSE/GCSE%20Science%20Double%20Award%20%282017%29/2024/GCSE%20Science%20Double%20Award%20%282017%29-Summer2024-Report_0.pdf",
      "asked": "Identify the variables in a spring investigation, then use F = ke.",
      "wentWrong": "Variables were mostly right, but the dependent variable had to be the compressed length specifically; the unit of the spring constant was not well known.",
      "rule": "Name the variable exactly as it is measured in this experiment; k is in N/m (or N/cm).",
      "misconceptions": [
        "sci.practical.control-vs-independent",
        "sci.hooke.spring-constant-formula"
      ]
    },
    {
      "source": "ccea-cer:science:2025-summer:U7BPhysH:Q1",
      "url": "https://ccea.org.uk/downloads/docs/ExamMod-Reports/GCSE/GCSE%20Science%20Double%20Award%20%282017%29/2025/GCSE%20Science%20Double%20Award%20%282017%29-Summer2025-Report_0.pdf",
      "asked": "Plan how to find the density of an irregular solid, give a precaution and its reason, state the density equation.",
      "wentWrong": "Many measured 'length, breadth and height' with a ruler, missing the word irregular; precautions were fine but 'to improve accuracy' was the common wrong reason; a significant minority wrote density = mass x volume.",
      "rule": "Irregular solid: mass on a balance, volume by displacement; density = mass / volume.",
      "misconceptions": [
        "sci.density.formula-or-method",
        "sci.practical.reliability-accuracy-confused"
      ]
    },
    {
      "source": "ccea-cer:science:2025-summer:U7BBioH:Q1",
      "url": "https://ccea.org.uk/downloads/docs/ExamMod-Reports/GCSE/GCSE%20Science%20Double%20Award%20%282017%29/2025/GCSE%20Science%20Double%20Award%20%282017%29-Summer2025-Report_0.pdf",
      "asked": "Six-mark QWC on estimating plant abundance in a habitat.",
      "wentWrong": "Most answers reached four marks or more, yet few mentioned a key for naming the species, and some could not name the quadrat.",
      "rule": "Quadrat, random placement, key to identify, count, repeat and average, scale up.",
      "misconceptions": [
        "sci.practical.quadrat-and-key-not-named"
      ]
    },
    {
      "source": "ccea-cer:science:2025-summer:C1H:Q1",
      "url": "https://ccea.org.uk/downloads/docs/ExamMod-Reports/GCSE/GCSE%20Science%20Double%20Award%20%282017%29/2025/GCSE%20Science%20Double%20Award%20%282017%29-Summer2025-Report_0.pdf",
      "asked": "Safety precautions when reacting sodium with water.",
      "wentWrong": "Generally known; a 'glass screen' was not credited in place of a safety screen.",
      "rule": "Safety = the specific hazard and the specific named control.",
      "misconceptions": [
        "sci.practical.safety-vague"
      ]
    }
  ],
  "ruleToRemember": "A plan names the independent, dependent and control variables in the experiment's own terms, chooses apparatus by name, draws it as a labelled 2-D cross-section with open paths, states a specific hazard and control, and says what will be measured, how, and how many times. Repeating improves reliability, not accuracy.",
  "aStarSignal": "A plan that a stranger could follow: named apparatus, a working diagram, exact variables, a results table with units, and a precaution with its reason."
}
