{
  "id": "ins.fm.u1.integration-as-inverse",
  "topic": "fm.u1.integration-as-inverse",
  "specRefs": [
    "FM1-INT-01",
    "FM1-INT-02"
  ],
  "findings": [
    {
      "source": "ccea-cer:further-maths:2019-summer:FM1:Q3",
      "url": "https://ccea.org.uk/downloads/docs/ExamMod-Reports/GCSE/GCSE%20Further%20Mathematics%20(2017)/2019/GCSE%20Further%20Mathematics%20(2017)-Summer2019-Report.pdf",
      "asked": "Differentiate, then integrate an expression.",
      "wentWrong": "Signs of the second term went wrong and the constant of integration was omitted.",
      "rule": "Every indefinite integral ends with + c.",
      "misconceptions": [
        "fm.int.constant-omitted"
      ]
    },
    {
      "source": "ccea-cer:further-maths:2022-summer:FM1:Q2",
      "url": "https://ccea.org.uk/downloads/docs/ExamMod-Reports/GCSE/GCSE%20Further%20Mathematics%20(2017)/2022/GCSE%20Further%20Mathematics%20(2017)-Summer2022-Report_0.pdf",
      "asked": "Basic integration.",
      "wentWrong": "Errors in the second term; some still omitted the constant, though fewer than before.",
      "rule": "Raise the power, divide by the new power, add c.",
      "misconceptions": [
        "fm.int.constant-omitted"
      ]
    },
    {
      "source": "ccea-cer:further-maths:2023-summer:FM1:Q2",
      "url": "https://ccea.org.uk/downloads/docs/ExamMod-Reports/GCSE/GCSE%20Further%20Mathematics%20(2017)/2023/GCSE%20Further%20Mathematics%20(2017)-Summer2023-Report_0.pdf",
      "asked": "Find the equation of a curve from its gradient function and a point.",
      "wentWrong": "Many left out c or failed to find it; some kept the integral sign after integrating; some did definite integration between 2 and 7; a few found the second derivative.",
      "rule": "Integrate, add c, substitute the point to find c, write y = ....",
      "misconceptions": [
        "fm.int.constant-omitted",
        "fm.int.definite-instead-of-indefinite",
        "fm.int.differentiated-instead"
      ]
    },
    {
      "source": "ccea-cer:further-maths:2024-summer:FM1:Q1",
      "url": "https://ccea.org.uk/downloads/docs/ExamMod-Reports/GCSE/GCSE%20Further%20Mathematics%20(2017)/2024/GCSE%20Further%20Mathematics%20(2017)-Summer2024-Report_0.pdf",
      "asked": "Differentiate a term with a negative index; then find y from dy/dx.",
      "wentWrong": "The index term was mishandled in differentiation; in (ii) many did not realise integration was needed, and c was missing or wrong.",
      "rule": "From dy/dx back to y is integration.",
      "misconceptions": [
        "fm.calc.negative-power-differentiation",
        "fm.int.differentiated-instead",
        "fm.int.constant-omitted"
      ]
    },
    {
      "source": "ccea-cer:further-maths:2025-summer:FM1:Q6",
      "url": "https://ccea.org.uk/downloads/docs/ExamMod-Reports/GCSE/GCSE%20Further%20Mathematics%20(2017)/2025/GCSE%20Further%20Mathematics%20(2017)-Summer2025-Report_0.pdf",
      "asked": "Find the equation of a curve given its gradient function and a point.",
      "wentWrong": "The word 'gradient' triggered differentiation; some tried y = mx + c at x = 1; those who integrated left answers unsimplified or wrote c separately; some used limits 1 and 5.",
      "rule": "Given the gradient function, integrate; use the point to fix c; present one equation.",
      "misconceptions": [
        "fm.int.gradient-word-triggers-differentiation",
        "fm.int.definite-instead-of-indefinite",
        "fm.int.constant-omitted"
      ]
    }
  ],
  "ruleToRemember": "Given dy/dx, integrate (power up, divide), add + c, substitute the given point to find c, and write the full equation y = ...; 'gradient function' means you are going backwards, not differentiating.",
  "aStarSignal": "Recognising an integration task disguised by the word 'gradient' and presenting the curve as one simplified equation."
}
