{
  "id": "ins.science.p1.nuclear-fusion",
  "topic": "science.p1.nuclear-fusion",
  "specRefs": [
    "DA-P1-1.5.20",
    "DA-P1-1.5.21",
    "DA-P1-1.5.22",
    "DA-P1-1.5.23"
  ],
  "findings": [
    {
      "source": "ccea-cer:science:2025-summer:P1F:Q8",
      "url": "https://ccea.org.uk/downloads/docs/ExamMod-Reports/GCSE/GCSE%20Science%20Double%20Award%20%282017%29/2025/GCSE%20Science%20Double%20Award%20%282017%29-Summer2025-Report_0.pdf",
      "asked": "Six-mark QWC describing nuclear fusion.",
      "wentWrong": "Very few scored more than two: fusion was confused with fission; 'atoms' were said to join rather than nuclei; that it happens naturally in the Sun and stars was sometimes recalled; the main by-product (helium) was rarely given, with 'energy' the usual wrong answer.",
      "rule": "Two light nuclei join to make a heavier nucleus (helium) and release energy.",
      "misconceptions": [
        "sci.nuclear.fusion-fission-confused",
        "sci.nuclear.atoms-instead-of-nuclei",
        "sci.nuclear.energy-given-as-by-product"
      ]
    },
    {
      "source": "ccea-cer:science:2025-summer:P1H:Q3",
      "url": "https://ccea.org.uk/downloads/docs/ExamMod-Reports/GCSE/GCSE%20Science%20Double%20Award%20%282017%29/2025/GCSE%20Science%20Double%20Award%20%282017%29-Summer2025-Report_0.pdf",
      "asked": "The same fusion QWC at Higher.",
      "wentWrong": "Most found it hard: what happens to the nuclei was not explained, the release of energy was left out, and energy was again offered as the by-product.",
      "rule": "Say nuclei, say join, say energy released, say helium.",
      "misconceptions": [
        "sci.nuclear.energy-release-omitted",
        "sci.nuclear.energy-given-as-by-product",
        "sci.nuclear.atoms-instead-of-nuclei"
      ]
    }
  ],
  "ruleToRemember": "Fusion: two light (hydrogen) nuclei join at very high temperature and pressure to form a heavier helium nucleus, releasing a large amount of energy; it powers the Sun and stars, and it is hard to achieve on Earth. Fission is the splitting of a heavy nucleus - the opposite.",
  "aStarSignal": "A fusion QWC that contrasts it with fission, names the conditions, the product and the energy, and mentions why it is not yet a practical power source."
}
