{
  "id": "ins.fm.u1.curve-sketching-quadratic-cubic",
  "topic": "fm.u1.curve-sketching-quadratic-cubic",
  "specRefs": [
    "FM1-DIF-02"
  ],
  "findings": [
    {
      "source": "ccea-cer:further-maths:2018-summer:FM1:Q9",
      "url": "https://ccea.org.uk/downloads/docs/ExamMod-Reports/GCSE/GCSE%20Further%20Mathematics%20(2017)/2018/GCSE%20Further%20Mathematics%20(2017)-Summer2018-Report.pdf",
      "asked": "Intercepts, turning points, then sketch a cubic.",
      "wentWrong": "Some differentiated in the intercepts part; sketches did not extend to all relevant regions.",
      "rule": "Intercepts: set y = 0 and x = 0 - no calculus yet.",
      "misconceptions": [
        "fm.calc.differentiate-when-intercepts-asked"
      ]
    },
    {
      "source": "ccea-cer:further-maths:2019-summer:FM1:Q8",
      "url": "https://ccea.org.uk/downloads/docs/ExamMod-Reports/GCSE/GCSE%20Further%20Mathematics%20(2017)/2019/GCSE%20Further%20Mathematics%20(2017)-Summer2019-Report.pdf",
      "asked": "Standard curve sketching.",
      "wentWrong": "x-values given instead of coordinates; differentiation in the intercept part; errors in the y-value of a turning point; two maxima found without noticing the contradiction; sketches missing labelled points.",
      "rule": "A cubic has one maximum and one minimum - a contradiction means an error.",
      "misconceptions": [
        "fm.calc.differentiate-when-intercepts-asked",
        "fm.calc.sketch-contradicts-results"
      ]
    },
    {
      "source": "ccea-cer:further-maths:2022-summer:FM1:Q10",
      "url": "https://ccea.org.uk/downloads/docs/ExamMod-Reports/GCSE/GCSE%20Further%20Mathematics%20(2017)/2022/GCSE%20Further%20Mathematics%20(2017)-Summer2022-Report_0.pdf",
      "asked": "Turning points and nature, sketch, then area.",
      "wentWrong": "Some wrote the derivatives without knowing what to do; some confused the axis crossings with turning points; a maximum below the x-axis confused the sketch.",
      "rule": "Plot the turning points you found and draw the curve through them regardless of where they sit.",
      "misconceptions": [
        "fm.calc.sketch-contradicts-results"
      ]
    },
    {
      "source": "ccea-cer:further-maths:2023-summer:FM1:Q12",
      "url": "https://ccea.org.uk/downloads/docs/ExamMod-Reports/GCSE/GCSE%20Further%20Mathematics%20(2017)/2023/GCSE%20Further%20Mathematics%20(2017)-Summer2023-Report_0.pdf",
      "asked": "Where a cubic meets the axes; expand; turning points; nature; sketch.",
      "wentWrong": "(0, 0) was added as an intercept out of habit; brackets omitted in expansion; sketches sometimes had a maximum below a minimum or were not attempted.",
      "rule": "Read the intercepts from the factorised form; the sketch must match your own results.",
      "misconceptions": [
        "fm.calc.origin-assumed-on-cubic",
        "fm.calc.sketch-contradicts-results"
      ]
    },
    {
      "source": "ccea-cer:further-maths:2024-summer:FM1:Q10",
      "url": "https://ccea.org.uk/downloads/docs/ExamMod-Reports/GCSE/GCSE%20Further%20Mathematics%20(2017)/2024/GCSE%20Further%20Mathematics%20(2017)-Summer2024-Report_0.pdf",
      "asked": "Intercepts, turning points, sketch.",
      "wentWrong": "Differentiating in part (i) again, which then spoiled the sketch shape.",
      "rule": "Part (i) is intercepts; calculus starts at the turning points.",
      "misconceptions": [
        "fm.calc.differentiate-when-intercepts-asked"
      ]
    },
    {
      "source": "ccea-cer:further-maths:2025-summer:FM1:Q11",
      "url": "https://ccea.org.uk/downloads/docs/ExamMod-Reports/GCSE/GCSE%20Further%20Mathematics%20(2017)/2025/GCSE%20Further%20Mathematics%20(2017)-Summer2025-Report_0.pdf",
      "asked": "Quadratic: intercepts, turning point, sketch, area.",
      "wentWrong": "Some differentiated for the intercepts; the turning point was not written as a coordinate; a few drew cubics; key points unlabelled.",
      "rule": "Label intercepts and the turning point as coordinates on the sketch.",
      "misconceptions": [
        "fm.calc.differentiate-when-intercepts-asked"
      ]
    }
  ],
  "ruleToRemember": "Intercepts from y = 0 and x = 0 (no calculus); turning points from dy/dx = 0 with nature from the second derivative; the sketch must pass through your intercepts and turning points with all of them labelled as coordinates."
}
