{
  "id": "ins.fm.u2.newtons-second-law-inclined-plane",
  "topic": "fm.u2.newtons-second-law-inclined-plane",
  "specRefs": [
    "FM2-NEW-01"
  ],
  "findings": [
    {
      "source": "ccea-cer:further-maths:2019-summer:FM2:Q6",
      "url": "https://ccea.org.uk/downloads/docs/ExamMod-Reports/GCSE/GCSE%20Further%20Mathematics%20(2017)/2019/GCSE%20Further%20Mathematics%20(2017)-Summer2019-Report.pdf",
      "asked": "Compare accelerations for two options of pulling a block on a slope.",
      "wentWrong": "Some computed both accelerations in the same direction and got one negative; sin/cos swapped; g omitted; arithmetic slips.",
      "rule": "Resolve along the stated direction of motion so each acceleration comes out positive.",
      "misconceptions": [
        "fm.forces.resultant-direction-not-motion",
        "fm.forces.sin-cos-swapped",
        "fm.forces.g-omitted-weight"
      ]
    },
    {
      "source": "ccea-cer:further-maths:2024-summer:FM2:Q3",
      "url": "https://ccea.org.uk/downloads/docs/ExamMod-Reports/GCSE/GCSE%20Further%20Mathematics%20(2017)/2024/GCSE%20Further%20Mathematics%20(2017)-Summer2024-Report_0.pdf",
      "asked": "Resolve two forces at angles and find the resultant.",
      "wentWrong": "Sin/cos mix-ups; some did not resolve one of the forces; some swapped the magnitude and the angle.",
      "rule": "Each force: magnitude times cos or sin of ITS angle to the axis.",
      "misconceptions": [
        "fm.forces.sin-cos-swapped",
        "fm.forces.magnitude-angle-swapped"
      ]
    },
    {
      "source": "ccea-cer:further-maths:2025-summer:FM2:Q6",
      "url": "https://ccea.org.uk/downloads/docs/ExamMod-Reports/GCSE/GCSE%20Further%20Mathematics%20(2017)/2025/GCSE%20Further%20Mathematics%20(2017)-Summer2025-Report_0.pdf",
      "asked": "Block on a rough slope: friction, resultant, F = ma, then further motion.",
      "wentWrong": "Diagram errors, then the usual sin/cos confusion; most identified the frictional force (33.6 N) and applied F = 7a; the follow-through into the final part was well done.",
      "rule": "Along the slope: driving force minus friction minus weight component = ma.",
      "misconceptions": [
        "fm.forces.sin-cos-swapped"
      ]
    }
  ],
  "ruleToRemember": "Resolve along and perpendicular to the slope with the weight component mg sin(angle) along it; take the positive direction as the direction of motion; friction opposes motion."
}
