{
  "id": "ins.maths.m4.frustums-and-compound-solids",
  "topic": "maths.m4.frustums-and-compound-solids",
  "specRefs": [
    "M4-GM-01"
  ],
  "findings": [
    {
      "source": "ccea-cer:maths:2024-november:M4:Q12",
      "url": "https://ccea.org.uk/downloads/docs/ExamMod-Reports/GCSE/GCSE%20Mathematics%20%282017%29/2024/GCSE%20Mathematics%20%282017%29-November2024-Report_0.pdf",
      "asked": "Total surface area of a solid made of two cylinders stacked.",
      "wentWrong": "Only the strongest finished; errors included finding volume, forgetting to subtract the small circle where the cylinders meet, and using the wrong curved-surface formula. Examiners asked for work laid out with each calculation named.",
      "fullMarkAnswersDid": "Listed the external faces: two curved surfaces, the top circle, the bottom circle, and the ring (large circle minus small circle) where they join.",
      "rule": "Count only surfaces that touch the air, and label each one.",
      "misconceptions": [
        "maths.mensuration.hidden-faces-counted",
        "maths.presentation.unlabelled-calculations",
        "maths.mensuration.volume-for-surface-area"
      ]
    },
    {
      "source": "ccea-cer:maths:2024-november:M3:Q26",
      "url": "https://ccea.org.uk/downloads/docs/ExamMod-Reports/GCSE/GCSE%20Mathematics%20%282017%29/2024/GCSE%20Mathematics%20%282017%29-November2024-Report_0.pdf",
      "asked": "The same compound surface area on M3.",
      "wentWrong": "Many totalled the complete surface areas of both cylinders; others could not see the middle ring as a difference of circles; a large number calculated volumes instead.",
      "rule": "The contact ring is the difference of two circles.",
      "misconceptions": [
        "maths.mensuration.hidden-faces-counted",
        "maths.mensuration.volume-for-surface-area"
      ]
    },
    {
      "source": "ccea-cer:maths:2024-november:M4:Q22",
      "url": "https://ccea.org.uk/downloads/docs/ExamMod-Reports/GCSE/GCSE%20Mathematics%20%282017%29/2024/GCSE%20Mathematics%20%282017%29-November2024-Report_0.pdf",
      "asked": "Find a cone's radius from the volume of a frustum-like difference of cones.",
      "wentWrong": "Almost nobody finished: the subtraction of volumes was set up by some, but 3r was squared without brackets and the simplification failed.",
      "rule": "Bracket (3r) before squaring; simplify each term separately.",
      "misconceptions": [
        "maths.algebra.bracket-before-squaring"
      ]
    }
  ],
  "ruleToRemember": "List the external faces of a compound solid one by one (the contact ring is a difference of two circles), label each calculation, and bracket scaled radii before squaring.",
  "aStarSignal": "A frustum or stacked-solid problem set up as an equation in an unknown radius and solved without bracket errors."
}
