{
  "id": "ins.maths.m7.quadratic-graphs-and-intersections-with-straight-lines",
  "topic": "maths.m7.quadratic-graphs-and-intersections-with-straight-lines",
  "specRefs": [
    "M7-NA-10"
  ],
  "findings": [
    {
      "source": "ccea-cer:maths:2024-summer:M71:Q10",
      "url": "https://ccea.org.uk/downloads/docs/ExamMod-Reports/GCSE/GCSE%20Mathematics%20%282017%29/2024/GCSE%20Mathematics%20%282017%29-Summer2024-Report_0.pdf",
      "asked": "Table of values, plot a quadratic, read its roots, draw a line and read the intersections.",
      "wentWrong": "Incorrect y-values (-2, -4) from negative x; points joined with straight lines or a flat bottom between two equal minimum points; only one root given; the line y = 2x - 3 not drawn (a horizontal line appeared); intersections rarely both stated.",
      "rule": "Smooth curve through every point; both roots; a table of values for the line.",
      "misconceptions": [
        "maths.graphs.negative-x-substitution",
        "maths.graphs.points-joined-with-ruler",
        "maths.graphs.curve-flat-between-minimum-points",
        "maths.graphs.one-intersection-only"
      ]
    },
    {
      "source": "ccea-cer:maths:2024-summer:M81:Q4",
      "url": "https://ccea.org.uk/downloads/docs/ExamMod-Reports/GCSE/GCSE%20Mathematics%20%282017%29/2024/GCSE%20Mathematics%20%282017%29-Summer2024-Report_0.pdf",
      "asked": "Table, curve, roots, a line, then which line solves a given equation.",
      "wentWrong": "Table and line mostly right; under half read both roots; only the strongest knew which line to draw to solve the given equation.",
      "rule": "Rearrange the target equation so one side is the curve's function; the other side is the line to draw.",
      "misconceptions": [
        "maths.graphs.one-intersection-only",
        "maths.graphs.wrong-line-to-solve-equation"
      ]
    },
    {
      "source": "ccea-cer:maths:2025-november:M72:Q15",
      "url": "https://ccea.org.uk/downloads/docs/ExamMod-Reports/GCSE/GCSE%20Mathematics%20%282017%29/2025/GCSE%20Mathematics%20%282017%29-November2025-Report_0.pdf",
      "asked": "Plot a quadratic, read a value at x = 2.6 from the graph, and its minimum.",
      "wentWrong": "Points ruled together; (1, 0) and (2, 0) joined flat instead of dipping; substituting into the equation instead of using the graph scored nothing; the y-scale of 0.2 was misread; many wrote 0 for a minimum that was clearly below zero.",
      "rule": "Use the graph when told to, read the scale, and let the curve dip between roots.",
      "misconceptions": [
        "maths.graphs.points-joined-with-ruler",
        "maths.graphs.curve-flat-between-minimum-points",
        "maths.graphs.substitute-instead-of-read-graph"
      ]
    },
    {
      "source": "ccea-cer:maths:2025-november:M82:Q7",
      "url": "https://ccea.org.uk/downloads/docs/ExamMod-Reports/GCSE/GCSE%20Mathematics%20%282017%29/2025/GCSE%20Mathematics%20%282017%29-November2025-Report_0.pdf",
      "asked": "Quadratic graph with negative x-values, readings, minimum, and a harder final part.",
      "wentWrong": "Negative substitutions went wrong; straight segments between the lowest points; only 35% read the minimum with the scale; the last part was for the top fifth.",
      "rule": "Check signs for negative x; the minimum is on the curve, not at a plotted point.",
      "misconceptions": [
        "maths.graphs.negative-x-substitution",
        "maths.graphs.curve-flat-between-minimum-points"
      ]
    }
  ],
  "ruleToRemember": "Complete the table carefully for negative x, draw one smooth curve that dips below the lowest plotted points, read both roots or intersections, and to solve a given equation graphically rearrange it into 'curve = line'.",
  "aStarSignal": "Deciding which straight line to add to the quadratic to solve an unrelated-looking equation."
}
